{
  "as_of": "2026-10-19",
  "generated_at_utc": "2026-10-19T23:45:00Z",
  "as_of_note": "US closes for Mon 19 Oct 2026: narrow AI/chip relief bounce (Nasdaq +1.11%, SOX +1.61%) while equal-weight S&P fell 0.32% and decliners led ~2:1. 10Y rose 3.8bp to 5.135%; Nov WTI (expires 20 Oct) settled $103.66 on Houthi claims of attacks on Saudi energy sites. Fed in blackout before 27-28 Oct FOMC; Oct hike odds ~15%, Dec ~89%. Monday-night futures +0.1-0.2%.",
  "indices": [
    {
      "name": "S&P 500",
      "symbol": "^GSPC",
      "level": 7690.73,
      "date": "2026-10-19",
      "change_1d_pct": 0.41,
      "change_1m_pct": 0.53,
      "change_ytd_pct": 12.3,
      "source_url": "https://www.wsj.com/finance/investing/u-s-stocks-mostly-higher-as-ai-credit-worries-abate-600bf008",
      "secondary_source_url": "https://www.kvue.com/article/syndication/associatedpress/how-major-us-stock-indexes-fared-monday-10192026/616-4602b371-b514-4d3d-8d2a-7416c4823997",
      "note": "+31.29 pts. 1M vs 18 Sep close 7650.50 (Portfolio Terminal), computed; YTD from AP. 1.64% below 6 Oct record 7818.93 (computed). Equal-weight RSP -0.32% (Cappnotes)."
    },
    {
      "name": "Nasdaq Composite",
      "symbol": "^IXIC",
      "level": 26430.89,
      "date": "2026-10-19",
      "change_1d_pct": 1.11,
      "change_1m_pct": -0.35,
      "change_ytd_pct": 13.7,
      "source_url": "https://www.wsj.com/finance/investing/u-s-stocks-mostly-higher-as-ai-credit-worries-abate-600bf008",
      "secondary_source_url": "https://www.kvue.com/article/syndication/associatedpress/how-major-us-stock-indexes-fared-monday-10192026/616-4602b371-b514-4d3d-8d2a-7416c4823997",
      "note": "+290.85 pts. 1M vs 18 Sep close 26522.54, computed; YTD from AP. Nasdaq 100 +1.1%, best day since 21 Sep (KobeissiLetter)."
    },
    {
      "name": "Dow Jones Industrial Average",
      "symbol": "^DJI",
      "level": 51966.03,
      "date": "2026-10-19",
      "change_1d_pct": -0.07,
      "change_1m_pct": 0.55,
      "change_ytd_pct": 8.1,
      "source_url": "https://www.wsj.com/finance/investing/u-s-stocks-mostly-higher-as-ai-credit-worries-abate-600bf008",
      "secondary_source_url": "https://www.kvue.com/article/syndication/associatedpress/how-major-us-stock-indexes-fared-monday-10192026/616-4602b371-b514-4d3d-8d2a-7416c4823997",
      "note": "-36.38 pts; JPM -1.79% weighed, AMZN +4.98% top gainer. 1M vs 18 Sep close 51682.64, computed; YTD from AP."
    },
    {
      "name": "Russell 2000",
      "symbol": "^RUT",
      "level": 2728.3,
      "date": "2026-10-19",
      "change_1d_pct": 0.25,
      "change_1m_pct": -4.62,
      "change_ytd_pct": 9.9,
      "source_url": "https://www.kvue.com/article/syndication/associatedpress/how-major-us-stock-indexes-fared-monday-10192026/616-4602b371-b514-4d3d-8d2a-7416c4823997",
      "secondary_source_url": "https://cappnotes.substack.com/p/closing-look-monday-october-19-2026",
      "note": "+6.93 pts. 1M vs 18 Sep close 2860.40, computed; YTD from AP."
    }
  ],
  "indices_note": "Closes from WSJ/Dow Jones and AP index wrap (via KVUE), cross-checked with Cappnotes and Investing.com. 1M % computed vs 18 Sep 2026 closes (19 Sep was a Saturday) from Portfolio Terminal: https://portfolio-terminal.com/markets/stock-market-close/september-18-2026",
  "sectors": [
    {
      "sector": "Information Technology",
      "proxy_etf": "XLK",
      "as_of": "2026-10-19",
      "change_1m_pct": -1.92,
      "change_ytd_pct": 29.17,
      "take": "+1.36% 1D (-5.30% 1W); SOX +1.61% ended 8-day slide; MU +2.97%, WDC +6.1%, INTC +2.43%, NVDA +1.38%.",
      "source_url": "https://marketindicators.net/sectors"
    },
    {
      "sector": "Energy",
      "proxy_etf": "XLE",
      "as_of": "2026-10-19",
      "change_1m_pct": 5.43,
      "change_ytd_pct": 51.64,
      "take": "-0.64% 1D despite Nov WTI +2.22% to $103.66; Dec WTI -0.48%, Brent -0.28% on Russia sanctions waiver.",
      "source_url": "https://marketindicators.net/sectors"
    },
    {
      "sector": "Health Care",
      "proxy_etf": "XLV",
      "as_of": "2026-10-19",
      "change_1m_pct": 4.31,
      "change_ytd_pct": 13.47,
      "take": "-0.60% 1D; AMGN -1.75%.",
      "source_url": "https://marketindicators.net/sectors"
    },
    {
      "sector": "Financials",
      "proxy_etf": "XLF",
      "as_of": "2026-10-19",
      "change_1m_pct": -1.43,
      "change_ytd_pct": 0.53,
      "take": "-0.83% 1D; JPM -1.79% as yields rose; FITB +0.28% on EPS beat/revenue miss.",
      "source_url": "https://marketindicators.net/sectors"
    },
    {
      "sector": "Consumer Discretionary",
      "proxy_etf": "XLY",
      "as_of": "2026-10-19",
      "change_1m_pct": 3.09,
      "change_ytd_pct": -4.15,
      "take": "Best sector, +1.78% 1D; AMZN +4.98%, TSLA +3.76%.",
      "source_url": "https://marketindicators.net/sectors"
    },
    {
      "sector": "Consumer Staples",
      "proxy_etf": "XLP",
      "as_of": "2026-10-19",
      "change_1m_pct": 5.33,
      "change_ytd_pct": 12.27,
      "take": "-0.47% 1D as defensive bid faded.",
      "source_url": "https://marketindicators.net/sectors"
    },
    {
      "sector": "Industrials",
      "proxy_etf": "XLI",
      "as_of": "2026-10-19",
      "change_1m_pct": -1.81,
      "change_ytd_pct": 7.45,
      "take": "-0.64% 1D; MMM -1.66% ahead of Tue earnings.",
      "source_url": "https://marketindicators.net/sectors"
    },
    {
      "sector": "Materials",
      "proxy_etf": "XLB",
      "as_of": "2026-10-19",
      "change_1m_pct": 1.92,
      "change_ytd_pct": 12.35,
      "take": "Flat (+0.06% 1D); CLF +16.3% on beat; FMC, MOS among S&P laggards.",
      "source_url": "https://marketindicators.net/sectors"
    },
    {
      "sector": "Utilities",
      "proxy_etf": "XLU",
      "as_of": "2026-10-19",
      "change_1m_pct": 0.63,
      "change_ytd_pct": -3.12,
      "take": "Worst sector, -2.01% 1D as 10Y rose to 5.135%; NRG -4.21%.",
      "source_url": "https://marketindicators.net/sectors"
    },
    {
      "sector": "Real Estate",
      "proxy_etf": "XLRE",
      "as_of": "2026-10-19",
      "change_1m_pct": -2.02,
      "change_ytd_pct": 3.27,
      "take": "-1.16% 1D on higher yields; HPP -12.4% on Piper downgrade citing rates.",
      "source_url": "https://marketindicators.net/sectors"
    },
    {
      "sector": "Communication Services",
      "proxy_etf": "XLC",
      "as_of": "2026-10-19",
      "change_1m_pct": -0.65,
      "change_ytd_pct": -6.48,
      "take": "-0.21% 1D; Alphabet ~+1% offset by rest of group.",
      "source_url": "https://marketindicators.net/sectors"
    }
  ],
  "sectors_note": "SPDR Select Sector ETF returns from marketindicators.net (Yahoo Finance underlying), page dated Mon 19 Oct 2026; 1D figures in takes from the same table, matching Cappnotes. Stock moves from Investing.com/Cappnotes. Takes are briefing commentary.",
  "macro": {
    "cpi_headline_yoy": {
      "value": 3.7,
      "unit": "%",
      "date": "2026-09",
      "source_url": "https://www.bls.gov/news.release/archives/cpi_10142026.htm",
      "period": "Sep 2026",
      "note": "Released 14 Oct. Above 3.6% consensus; up from 3.4% in Aug. Energy +20.4% y/y."
    },
    "cpi_headline_mom": {
      "value": 0.6,
      "unit": "%",
      "date": "2026-09",
      "source_url": "https://www.bls.gov/news.release/archives/cpi_10142026.htm",
      "period": "Sep 2026",
      "note": "Seasonally adjusted. In line with +0.6% consensus; gasoline +9.1% > half the rise."
    },
    "core_cpi_yoy": {
      "value": 2.6,
      "unit": "%",
      "date": "2026-09",
      "source_url": "https://www.bls.gov/news.release/archives/cpi_10142026.htm",
      "period": "Sep 2026",
      "note": "Above 2.5% consensus; up from 2.4% in Aug."
    },
    "core_cpi_mom": {
      "value": 0.3,
      "unit": "%",
      "date": "2026-09",
      "source_url": "https://www.bls.gov/news.release/archives/cpi_10142026.htm",
      "period": "Sep 2026",
      "note": "Hot vs +0.2% consensus; second straight 0.3%. Shelter +0.4%."
    },
    "cpi_september_consensus": {
      "headline_mom": "0.5-0.6",
      "headline_yoy": "3.6-3.7",
      "core_mom": "0.2",
      "core_yoy": "2.4-2.5",
      "release": "2026-10-14T08:30:00-04:00",
      "source_url": "https://www.cnbc.com/2026/10/14/cpi-inflation-report-september-2026.html",
      "secondary_source_url": "https://www.bls.gov/news.release/archives/cpi_10142026.htm"
    },
    "ppi_final_demand_mom": {
      "value": 1.3,
      "unit": "%",
      "date": "2026-09",
      "period": "Sep 2026",
      "source_url": "https://www.investing.com/news/economy-news/us-producer-prices-post-largest-increase-in-412-years-in-september-4951935",
      "secondary_source_url": "https://www.bls.gov/ppi/",
      "note": "Released 15 Oct. Largest since Mar 2022; Reuters poll +0.5% (other desks +0.6%). Goods +2.6% (record), services +0.8%."
    },
    "ppi_final_demand_yoy": {
      "value": 6.3,
      "unit": "%",
      "date": "2026-09",
      "period": "Sep 2026",
      "source_url": "https://www.investing.com/news/economy-news/us-producer-prices-post-largest-increase-in-412-years-in-september-4951935",
      "secondary_source_url": "https://www.bls.gov/ppi/",
      "note": "Biggest since Dec 2022; Aug 5.6%. Consensus ~5.3-5.4%."
    },
    "core_ppi_mom": {
      "value": 0.7,
      "unit": "%",
      "date": "2026-09",
      "period": "Sep 2026",
      "source_url": "https://www.ausecure.com/gold-market-close-oct-15-2026/",
      "secondary_source_url": "https://x.com/DeItaone/status/2110712066533200250",
      "note": "vs +0.3% consensus; core y/y 5.0% vs 4.4%."
    },
    "retail_sales_mom": {
      "value": 0.8,
      "unit": "%",
      "date": "2026-09",
      "period": "Sep 2026",
      "source_url": "https://www.investing.com/news/economy-news/us-producer-prices-post-largest-increase-in-412-years-in-september-4951935",